
2016-04-02,1,1,1110,False,Recommended,This game it one of the best games i have played and i recomend u get it!,Rocket League®
2015-07-09,0,0,8,False,Recommended,Easy to pick up and difficult to master rocket league is an amazing bang for your buck game.Part fifa and part toy cars this games got fast paced action during pulse pounding matches.,Rocket League®
2015-07-17,0,0,50,False,Recommended,This is an Incredibly fun game to play with friends. Smooth gameplay and beautiful graphic with good multiplayer. If you love soccer you will definitely love this. Thanks to Archgop for sending this gift.,Rocket League®
2016-04-05,1,1,19,False,Recommended,Perfect &lt 3,Rocket League®
2016-04-10,1,1,61,False,Recommended,RIP my Internet I say git gud and Rocket on. Great game best played with friends. And good internet unless you want to rubberband like me.,Rocket League®
2016-04-10,1,1,28,False,Recommended,Great game!Great game!Great game!Chat has been disabled for 4 seconds.Great game!Wow!,Rocket League®
2015-07-12,0,0,94,False,Recommended,Awesome surprise hit of the summer. A+++ Will order again. Fast shipping good packaging and communication. Fast emails. Blends elements that on paper shouldn't work. I like driving cars. Nose is fruity with a slight metallic note. Taste is warm &amp surprisingly sweet but spicy with toffee oak and goodyear tire flavors. Finish is long and strong reminiscent of a vanilla gorrilla. Play this game when you are done with Witcher 3.,Rocket League®
2015-07-17,0,0,42,False,Recommended,Great Game so far!,Rocket League®
2016-02-14,0,0,1899,False,Recommended,Very nice and funny!,Rocket League®
2017-08-03,0,0,2113,False,Recommended,For all those that enjoy devising strategic solutions while under pressure as one engages in a battle of wits that will surely adapt oneself to a setting that may always prove unpredictable challenging and may also trouble many whom possess addictive personalities as they spiral downwards with an addiction that puts so many drugs to shame that this game might as well be illegal.,Rocket League®
2016-03-22,2,1,58,False,Recommended,Wow!Wow!Wow!Chat has been disabled...,Rocket League®
2016-04-11,1,1,5,False,Recommended,This game may look and feel a little childish but I swear if you yell POWER while kidding around you will feel likeJeremy Clarckson.,Rocket League®
2016-04-11,0,0,1064,False,Recommended,First game that I...100% ed x2Bought 2 times (PS4)Bought all DLC's x2Played for more than 250 hoursPlayed on my new GPUPlayed online multiplayer (I'm a single player person) that's saying a lot right there if you can't find something in this game you like there is something wrong with you even if it's just the music,Rocket League®
2016-02-14,0,0,433,False,Recommended,Lots of fun quick online matches puts you right into the action. Pretty easy learning curve but hard to master. Definitely would recommend for when its on sale. Doesn't feel like a complete enough game for a full retail game though. Either way I'm enjoying it a lot.,Rocket League®
2016-02-14,0,0,412,False,Recommended,dis game very fun,Rocket League®
2016-02-14,0,0,94,False,Recommended,Hitting balls never gets old.,Rocket League®
2016-02-14,0,0,21,False,Recommended,All there really is to say about Rocket League is...ROCKET LEAGUEEEEEEEEEEEEEEEEEE,Rocket League®
2016-02-14,0,0,715,False,Recommended,Balls have taken over my life. 10/10 IGN,Rocket League®
2017-08-22,0,0,2587,False,Recommended,absolutely love this game great pass time and competitive,Rocket League®
2015-12-28,0,0,377,False,Recommended,Smooth graphics intuitive controls and just plain fun. A must have for 2015.,Rocket League®
2016-12-28,0,0,4,False,Recommended,All i wanna say. is this game is awesome.. to those who are planning buying this game.. BUY IT.. its awesome and its even awesome when played with friends or cousins. 10/10 for me but to some people. they are giving a more in depth review rather than mine ),Rocket League®
2017-06-28,0,0,745,False,Recommended,A very competitive game!,Rocket League®
2015-07-18,1,1,11,False,Recommended,One of the funnest games ive played in a while fast paced thrilling and very fun!!!,Rocket League®
2017-10-29,0,0,1458,False,Recommended,Product received for free. I like the community and I dont like crates,Rocket League®
2016-03-26,1,1,145,False,Recommended,The game is cool but this review is for the Steam Badge,Rocket League®
2016-03-26,0,0,48,False,Recommended,It's no game (Part 1),Rocket League®
2016-03-26,0,0,19,False,Recommended,A sports game that can be enjoyed by people who hate sports games.,Rocket League®
2016-03-26,1,1,3,False,Recommended,CAN YOU GUYS PLEASE MAKE THIS FOR MAC YET?!!!?!!?!?!?!??!?!?!?!?!?!?!?!?!?1?/1?!?!?!?!?!?1?1/1/SKERNGJLIBECFIUAIWYRFGEBQADNJKEGBFWE LSAIWUEVFEBALJWRFVBEQWRBLFPLEASEEEEEEEEEEEEEEE,Rocket League®
2016-03-28,2,1,1402,False,Recommended,Buy a controllerstart this gamehit the ballscore a goalscore 50 goalsstart failingscore owngoalsrage alotdo trainingsyou are now impovingplay rocket labsplay competitivebut most importantlyhave fun,Rocket League®
2016-03-28,0,0,353,False,Recommended,Put cars and football together and you get this.,Rocket League®
2016-03-28,2,1,50,False,Recommended,Lel dis gaem is mlgpls subscroobel to mah mlg esports channelxXx_bAnAnAbIfF_xXx#proscopes #tekkers #tkrz #GOOOOOLlol jks asied dis gaem gud lol buy pls,Rocket League®
2016-04-12,0,0,578,False,Recommended,I have a problem. Somebody please help me.,Rocket League®
2016-04-17,1,1,943,False,Recommended,What are physics?,Rocket League®
2016-04-17,1,1,178,False,Recommended,Can destroy Dirty Peasants 10/10 would up peasants again,Rocket League®
2017-07-11,1,1,468,False,Recommended,A lot of fun to play with friends and totally worth the 20 dollars. I would recommend using a controller with this game since it makes it way better to control your car but the controls are nice and easy to learn. If you're looking for something to play with your friends this is a good game to get.,Rocket League®
2017-08-22,0,0,129,False,Recommended,asuck my,Rocket League®
2015-08-03,0,0,112,False,Recommended,Exactly like GYM classNobody ever passes to meI get yelled at for everythingEveryone pushes me around,Rocket League®
2017-05-25,0,0,2181,False,Recommended,umm yes,Rocket League®
2017-10-30,1,1,44,False,Recommended,Fun,Rocket League®
2017-10-30,0,0,93,False,Recommended,ranked system is pretty I always get thrown in with diamonds or noranks who were platin last season as a silver player...every other game makes it better than this Game is fun but this ranking is,Rocket League®
2016-03-29,0,0,301,False,Recommended,Absolute blast,Rocket League®
2016-03-31,1,1,662,False,Recommended,What a save!What a save!What a save! % $#,Rocket League®
2017-01-19,0,0,1057,False,Recommended,One of the best games i've ever play,Rocket League®
2017-08-23,0,0,1555,False,Recommended,Very nice game indeed and lots of fun.,Rocket League®
2016-10-29,0,0,389,False,Recommended,If you ever thought that cars and soccer wouldn't mix you are a retard. It is like two people were asked to say the first thing that came to their mind and this was the end result. If you like high flying high speed stunt action with a soccer ball then this is it. The game is as serious as you want it to be and equally as comical as you can imagine cars and soccer to be. Even before the rumble addition had been added this game was addicting. Rumble only served to make the gameplay that much more comical and addicting at the same time.,Rocket League®
2017-10-26,0,0,178,False,Recommended,Brillaint Game to play with friends!,Rocket League®
2016-12-25,0,0,658,False,Recommended,I'm gonna write something here later... just give me five more minutes...,Rocket League®
2016-07-25,0,0,2797,False,Recommended,Fun game worst community.,Rocket League®
2016-04-25,0,0,74,False,Not Recommended,it is a good Game But the ping in middle east is too high I would buy it when the ping become better.,Rocket League®
2017-08-11,1,1,1193,False,Recommended,Awesome game so much better than lucioball. 9/10 game 10/10 gameplay.,Rocket League®
2016-01-18,0,0,408,False,Recommended,Very nice game. Entertaining.,Rocket League®
2016-11-24,0,0,898,False,Recommended,"Perfect example for ""why hasn't anyone thought of this before?""",Rocket League®
2016-11-08,0,0,1357,False,Recommended,Perfect for playing for 10 minutes or 4 hours at a time. The most fun I've had playing a videogame... probably ever.,Rocket League®
2016-01-11,1,1,1426,False,Recommended,Fantastic game.,Rocket League®
2017-02-19,0,0,11,False,Recommended,Game is simple... custom make your own car and use it to hit a puck basketball or a soccer ball....Runs very smoothly..._______FOR PEOPLE WHO DOES NOT KNOW HOW TO PLAY BASKETBALL/ SOCCER/ HOCKEY!!!!!!!!_______+++IF YOU ARE ON THE ING BLUE TEAM HIT IT TO THE ORANGE GOAL/ BASKET!!!!!!! IF YOU ARE ON THE ING ORANGE TEAM HIT IT TO THE BLUE GOAL/ BASKET!!!!!!!Overall the if you're looking for a game to rage on because your team is ING WACK then this is the game for you....A lot fo stupid yet a lot of fun!!!!!! RECOMMENDED!,Rocket League®
2017-11-15,0,0,71,False,Recommended,This is an Awesome game i really enjoy playing it &lt 3,Rocket League®
2015-11-24,0,0,2136,False,Recommended,Been playing this game a while if fun frustrating and heart pounding. Learning to fly is the best part and will give you the advantage over the ball every time. The collection of parts is addictive with customisation being fun each DLC adds enough parts to change how you can look in a variety of ways.Team colours are are reduced for pratical sake but secondary paint colours are enough to fill any belly. Yes yes Black aswel. After playing this long enough black wont be enough.Most DLC has extra cars with them these cars usually have new paint jobs for just them. So dont expect Flames to be for every car.Parts Car Paint colours Hats radio Antenna ends Wheels Rocket Stream.Each part is unlocked as you play usually one per match. sometimes there'll be even only items for example Halloween had some bits you will only see from players who played at that time.Just think Nitro on an RC car.,Rocket League®
2016-01-18,0,0,50,False,Recommended,Amazing game i rate it 504/10. lol,Rocket League®
2015-12-28,0,0,294,False,Recommended,Cars with rockets playing soccer what's not to love. The price point of this game seemed high until I played the game. It's super fun and casual and I have gotten a lot of play time out of it. Even if I'm losing or playing poorly I rarely get salty when playing this game. Fun to just chill and relax while playing with friends. Of course there is also a growing competitive scene with a high skill cap.,Rocket League®
2016-01-19,0,0,92,False,Recommended,Actually very good indie game! It s really funny and u can be better and better and try some leagues like etc.! I recomend it!,Rocket League®
2015-08-05,0,0,133,False,Recommended,I have never hated my opponent more in my entire life.,Rocket League®
2017-11-15,0,0,156,False,Recommended,hours of fun no matter your skill level,Rocket League®
2016-01-18,0,0,222,False,Recommended,Rocket league is a wonderfully distilled piece of fun. Controls are simple actions are simple learning is simple. Even as a very casual adult player I can play against excellent players lose horribly and still have a blast. A++,Rocket League®
2015-10-18,0,0,713,False,Recommended,car goes vroom.,Rocket League®
2016-01-07,0,0,47,False,Recommended,so much ing fun,Rocket League®
2016-04-27,0,0,54,False,Recommended,Gudgame!,Rocket League®
2016-04-28,1,1,30,False,Recommended,you get to fly cars around and shoot goals pretty fun.,Rocket League®
2017-10-22,0,0,414,False,Recommended,one of the best games ive played.,Rocket League®
2017-02-27,0,0,154,False,Recommended,best game,Rocket League®
2015-10-27,0,0,22,False,Recommended,I only play this when I don't know what to play. Very addictive Be warned,Rocket League®
2016-04-28,0,0,1235,False,Recommended,Yes too many reasons to list. This game looks so simple from the outside but after a few hours of playing it you start to realize the massive potential you have to get better...and better..and better.11/10 Gameplay. Always a way to improve. Always a new challenge. No two games are the same.Psyonix is the most active and engaging developer team out there. They communicate well and fix issues almost immediately (even the game breaking bugs like the double rainbow) all while constantly adding additional features and new game modes to the game.,Rocket League®
2016-05-04,1,1,64,False,Recommended,Great game lots of replayability. Only game that makes me move my controller like a steering wheel for some reason.Scoring a good goal in this is like a hit of cocaine.9/10(quick reviews by elek),Rocket League®
2016-05-06,2,1,802,False,Recommended,So I started to experience withdrawal symptoms...,Rocket League®
2016-05-08,1,1,93,False,Recommended,I think this is one of my favourite games of all time,Rocket League®
2016-05-08,2,1,48,False,Recommended,Product received for free. I hate my friends,Rocket League®
2016-05-12,1,1,958,False,Recommended,Best game ever! Super fun to play with your friends. It would even better if it were updated more often.,Rocket League®
2017-10-22,0,0,1088,False,Recommended,Love this game and i would recommend to anyone that likes cars and soccer,Rocket League®
2017-10-21,1,1,246,False,Recommended,your dad cannot hurt you here,Rocket League®
2017-02-18,2,1,338,False,Recommended,my life force is being sucked out by this game,Rocket League®
2017-10-22,0,0,54,False,Recommended,Awesome game very addictive !,Rocket League®
2016-11-23,0,0,622,False,Recommended,Very fun game some people don't like it after a while but I enjoy this game a lot and I think that it will go very far. It's fun alone but it's even more fun with friends because then you can communicate and strategize the field. Overall I think it was worth the 20 dollars. ),Rocket League®
2016-01-18,0,0,214,False,Recommended,nice game nice DLC's.worth the money,Rocket League®
2016-05-12,0,0,1498,False,Recommended,One of the best games I've ever played! LOVE IT! D &lt 3,Rocket League®
2016-05-12,1,1,619,False,Recommended,2 things you need to know about this game 1) It's fun2) It's fun,Rocket League®
2017-05-03,0,0,10,False,Recommended,game that you would play for fun but that fun is reptitive once you hit 20 50 hrs and you are half decent when you start off you would know all the tricks and how to 'fly' or 'fart up'. so would recommend if you have friends who will play with you this game if not then have fun in your 40 hrs on this game P (i only have 10 hrs of this game and i got bored.),Rocket League®
2017-07-24,0,0,661,False,Recommended,Addictive game. Great gameplay servers are typically good the business model has gotten worse with time. Putting cars in the crates is obnoxious although I'm sure it brings more money in. Hopefully they're working on a new game as one can only be a one trick pony for so long even though it's an incredibly COMPELLING one trick pony.Protip turn off crates in settings before you're even tempted. You can buy plenty of better things than $1.50 CHANCES at cosmetic items.,Rocket League®
2016-12-28,1,1,1134,False,Recommended,Rocket League is a great goofy easy to learn and difficult to master action sports game which demands that you grab a few friends and play a few roun,Rocket League®
2017-02-27,0,0,943,False,Recommended,Really Great buy I reccomend to anyone looking for a casual or serious game. This game is great with family friends or by yourself!,Rocket League®
2017-09-26,0,0,237,False,Recommended,PROS Graphics are Very good and appealing. Gameplay is very good. Game Concept is very Unique. Game is very optimised Very well. Controls are also very good. Multiplayer Online Gameplay is also very good and less laggy. Very Uniquely Designed Cars. Sound Quality is good. Stadium Design are also good. CONS Need More number of Cars. Need More Customisable Parts like TailLight Under the car neons flashing Headlight Colors. No smoke coming out of car tyres when drifting. Give Us burnout type initial startup like when car is standing and match is about to begin revolve the tyres when rev. No xbox one controller impulse trigger vibration. NOTES Very good and addictive game once u start playing its never ending fun. At first it feels gameplay littleBoring but when u start getting hang of it the fun gets better and better as ur level and skill level Of playing this game increases. Give us xbox one controller impulse trigger vibration.Go for it Gamers its a true competitive game.,Rocket League®
2016-11-25,0,0,189,False,Recommended,One of the Best Games i played in my Life.Buy it Have Fun with it and blame your Friends when you lose Kappa,Rocket League®
2017-11-03,0,0,1,False,Recommended,Nice,Rocket League®
2016-04-23,1,1,142,False,Recommended,I have it for the free weekend and I win.,Rocket League®
2016-04-24,1,1,10,False,Recommended,"Scrub was bragging because he beat me and someone else. Called us salty.We won a match after losing a few he left instantly and was replaced by an AI named ""Saltie"".13.86/10 would shrek scrub again.",Rocket League®
2016-04-24,1,1,505,False,Recommended,This game is the bomb,Rocket League®
2017-06-19,1,1,912,False,Recommended,I've heard greatness of this game and so I decided to try it. I myself usually play MMO's or FPS' but I had to give this a shot. Little did I know that I was getting myself into a new addiction.The games are usually very short but very face paced so you can play multiple games within an hour easily. The gameplay itself is very unique and smooth kind of like Hot Wheels or Twisted Metal (without the weapons) meets soccer/football. It's very tricky to get used to at first but once you do you'll want to better yourself and play more and more.There is a TON of car customization and loads of different cars to choose from in this great game. From cute little puppies on your roof to snake eyes on your rims! Most items are earned through random drops rewarded to those that complete their games. There are however crates for those that want to spend a few bucks and maybe get something more but again you can get most things in game via end game rewards. The only gripe that I have is that the servers sometimes don't put you into a match this isn't around your rank. You can be Pro/Expert and play with Rookies or vise versa. Other than that this game is absolutely great unique fun and I highly recommend it to anyone out there!...........................................................................................................TL DRPros+ Emmersive gameplay+ Casual &amp Competitive gamemodes+ Friendly community+ Lots of car customization+ Great soundtracks+ Amazing car handling and air mechanics+ Holiday/E sports events+ Developers really listen to the communityCons Servers are sometimes slow to respond and give poor performance (EU) Can be placed in a game with much higher ranks as a noobRating 4.5 / 5,Rocket League®
2016-11-23,0,0,3279,False,Recommended,The RL gods hate me (,Rocket League®
2016-04-24,1,1,6,False,Recommended,played during the free weekend. wasted a few hours of my life. 11/10 would waste again,Rocket League®
2016-04-24,1,1,1,False,Recommended,10/10 Best Music,Rocket League®
2016-04-24,1,1,22,False,Recommended,Fun to play with friends. Nuf to say more.,Rocket League®
2016-04-24,1,1,17,False,Recommended,best game to ruin a friendship11/10,Rocket League®
2016-04-24,0,0,235,False,Recommended,brilliant game.,Rocket League®
2016-04-24,1,1,26,False,Recommended,simple,Rocket League®
2016-04-24,1,1,18,False,Recommended,What can I say its Rocket League Go Vroom Vroom and bounce ball in to goal Listen to awesome music from game soundtrack Play with friends FLY!!!,Rocket League®
2016-04-21,1,1,25,False,Recommended,Very Good Game I like it but matchmaking could be better because we play against bigger ranks then we are,Rocket League®
2016-04-21,1,1,1616,False,Recommended,BEST GAME EU!!!!!!!!!,Rocket League®
2016-04-21,1,1,7251,False,Recommended,god?,Rocket League®
2016-04-22,1,1,965,False,Recommended,Play it. Buy it. Play it.,Rocket League®
2016-04-22,5,1,103,False,Recommended,Before I played ( ʖ ) &lt ヽ / へ / / ﾚ ノ ヽ_つ / / / / ( (ヽ 丿 ) ) / ノ ) LﾉAfter I played ﾌﾌ ム ヽ / ノ) ヽ / ( ʖ ノ ゝ._ ノ / ﾉ 7 ヽーく 丶 ノ ノ / ヽ ー '_人 ーﾉ 丶 _人'彡),Rocket League®
2016-04-22,0,0,116,False,Recommended,I hate football but love Rocket League. It's a awesome game to play with friends or with randos. Definatly worth it even at full price. You can rankup from Rookie to Pro to Veteran etc. It's always funny when your pwning someone who is higher rank.I recommend this game to anyone.,Rocket League®
2016-04-22,0,0,2,False,Recommended,Fast pace simple and passionate! No wonder it's so popular.If you still have any doubt just give it a shot during this weekend while it's free. Definitely worth it.,Rocket League®
2016-04-22,1,1,136,False,Recommended,If you think this just doesn't look like your cup of tea and you won't like it you're wrong. Maybe it's too shallow a cup of tea. Maybe it's too weak. No my friend. This is not just any tea. This is a bottomless pit of chai picked from bright tropical rainbow fields. The steering is exquisite imagine delicately picking tea leaves with a humvee's grill with your tire treads spawning a billion new seedlings yet crushing none. Imagine the humvee runs on raw spices its smoke an aromatic blend of cinammon cardamon nutmeg and cloves. Imagine the humvee is filled with an oxygenated mass of ginger and lemon that you can float and breathe in and now you are flipping the tea leaves by flipping your fat humvee 720 degrees you are weightless and not remotely ill. Now you hop you leap and you are flying through the air. You're in a rocketship humvee and you're not as free as a bird but those tea leaves they are yours. And sometimes not there are others floating about making tea and sometimes they steal a sip of yours and vice versa but you don't mind at all in no small part because none of you are remotely milk intolerant and the clouds are branded A2 proteins. The heavens are raining warm honey milk down upon you your humvee is burping steam through the leaves and you are on a planet of foaming chai latte.That is Rocket League.,Rocket League®
2016-04-22,1,1,47,False,Recommended,You know that game is realistic when big guys pushes you around and bullies you. 11/10 would get bullied again.,Rocket League®
2016-04-22,0,0,1008,False,Recommended,Only game i enjoy giving the devs my money for all those dlc's. Keep up the good work. Its an amazing game for both those who just like fun and those who like to be serious,Rocket League®
2017-07-14,0,0,466,False,Recommended,Easy to pick up hard to master.,Rocket League®
2017-03-19,0,0,533,False,Recommended,its a realy good game and worth the money.its fun to play with friends _,Rocket League®
2017-07-15,0,0,703,False,Recommended,+REP COOL FANTASTIC GAME,Rocket League®
2016-10-23,0,0,169,False,Recommended,nice game,Rocket League®
2017-07-15,0,0,521,False,Recommended,The best game ever.,Rocket League®
2017-05-12,0,0,197,False,Recommended,It's k,Rocket League®
2017-07-15,0,0,68,False,Recommended,Yes the game is more about rushing and not about strats like Forza Horizon 2 but if you have a bunch of friends then buy this game all together and enjoy it as you can really have a lot of fun in it. AND its on Summer Sale right now so grab it and enjoy!,Rocket League®
2016-03-08,0,0,423,False,Recommended,This game is a man dream.Football + RC Cars Good Game.,Rocket League®
2016-11-27,0,0,156,False,Recommended,It's 3v3 soccer (futsal?) with rocket cars a match made in heaven. Success depends on a mix of technical skill reading the opponents and common sense strategy. At the same time there's plenty of chaos nobody can control the ball forever anyone can put the ball in the goal and an amazing play can happen at any time. The controls feel great and offer a wide range of motion riding up walls high speeds and even flight...after some practice. Player eliminations (executed by hitting an opponent at full speed) aren't rewarded or condoned in any way by themselves but sometimes they're exactly what you need to win.Rocket League was my favorite game the month it launched and it's still getting better every month. It's great alone online and even in local multiplayer. Essential Steam.,Rocket League®
2015-11-04,0,0,62,False,Recommended,Awesome competitve game!Overall this is a AWESOME GAME 133/7 WOULD RECCOMEND TO A FRIEND1 thing though... wish they upped the idle timer because i will go to pee and ill come back and i would be kicked.,Rocket League®
2017-06-01,0,0,1649,False,Recommended,&lt 3,Rocket League®
2017-09-12,0,0,900,False,Recommended,Wow!Nice one!Wow!Wow!Chat disabled for 1 seconds.,Rocket League®
2016-08-03,0,0,191,False,Recommended,Product received for free. Really cool as me and HEARTEYEEMOJI Glowy play together and we REALLY Recomend you all play it too! !!!!!(Why ???XD),Rocket League®
2016-01-01,0,0,33,False,Recommended,Good Game,Rocket League®
2016-01-12,0,0,1,False,Recommended,heaps as,Rocket League®
2016-06-25,1,1,1,False,Recommended,Fun AF,Rocket League®
2016-01-01,0,0,5,False,Recommended,this game is defintly worth the price Awsome game,Rocket League®
