
2017-09-17,0,0,0,False,Not Recommended,Steaming pile of garbadge where veteran players are placed into the same games as newbies. Horribly optimalized a joke of a tutorial and the only way to play with 1 or 2 friends is to always be survivors. Also there are only ranked modes with the exclusion of being able to play with a group of 5,Dead by Daylight
2017-09-17,1,1,1289,False,Recommended,Amazing game...lately though it's as if there are hackers and they seem to know where you are regardless if they can see you or not. I am loosing some interest.,Dead by Daylight
2017-02-12,0,0,17,False,Not Recommended,ตอนโหลดเข าเกม ตอนหาห อง ชอบค าง ค างบ อยมาก หาห องโคตรยาก..,Dead by Daylight
2017-02-14,0,0,148,False,Recommended,Product received for free. The new patch is good very 1.40 and fix's bug's very good,Dead by Daylight
2017-01-18,0,0,3,False,Not Recommended,i dont think this is a very interesting game.Although it will be funny if both me and some my friend have but if i play it alone i think is boring and dull,Dead by Daylight
2017-01-18,0,0,121,False,Not Recommended,This game was fun until the bugs made it literally unplayable.,Dead by Daylight
2017-02-06,0,0,258,False,Recommended,Nice game,Dead by Daylight
2017-02-23,0,0,113,False,Recommended,Just recently started playing pc and this was the first game I bought and I love it!!!,Dead by Daylight
2017-01-30,0,0,269,False,Recommended,good game,Dead by Daylight
2017-09-14,1,5,15,False,Not Recommended,killers are campers they camp the hook and ruin the whole game dont waste your time the community sucks,Dead by Daylight
2017-07-31,0,0,0,False,Not Recommended,no,Dead by Daylight
2017-10-30,0,0,73,False,Not Recommended,At first this game is okay good game then freddy come all f***ed up... as if freddy is a p2w killer,Dead by Daylight
2017-10-30,0,0,27,False,Not Recommended,Pay 2 Win with Freddy,Dead by Daylight
2017-06-22,0,0,1,False,Not Recommended,Gameplay wise it's not terrible. The community though... I have seen toxic groups before but never ones this bad. No matter what you do they are rude condecending and overall unpleasant to play with. So if you can stomach the toxicity go ahead otherwise stay away from this game I will.,Dead by Daylight
2017-03-15,0,0,243,False,Recommended,awesome game! gets some getting used to but still fun even well you lose.,Dead by Daylight
2017-06-07,1,1,5,False,Recommended,Waiting in lobby for 30 mins still no game.,Dead by Daylight
2018-08-07,0,0,20,False,Not Recommended,Love the game its fun to play and its easy to ignore the toxic people.The issue after this last update 2.1.1 Keep getting the connection error message.I have tried everything even uninstalling and reinstalling the game but nothing works. I would recommend the game but I can't when its not working properly When the fix it I will recommend the game.,Dead by Daylight
2016-07-02,0,0,5,False,Not Recommended,boring after a few matches,Dead by Daylight
2016-06-22,0,0,236,False,Recommended,This game is pretty great. It needs a party system for playing with one or two friends but that is in the works. Well worth the $18 they are asking for it currently.,Dead by Daylight
2016-12-16,3,1,0,False,Recommended,The nicest monster i've ever met. he let us do our objective and even gave me a piggy back to the exit even through i didn't want to leave!http //images.akamai.steamusercontent.com/ugc/112985497071762252/EBBB34C0B4FBF3267A27C0E7AECB2D1FDD99B752/http //images.akamai.steamusercontent.com/ugc/112985497071762388/F498A2BEC79168D93E0673E472D6FBA51B9E8CF3/http //images.akamai.steamusercontent.com/ugc/112985497071762466/57E76153C990218EA25B47387FBABAFAAAE747B9/http //images.akamai.steamusercontent.com/ugc/112985497071762721/73D8FAA46F06E1B4BFF459616035E8BB57053723/http //images.akamai.steamusercontent.com/ugc/112985497071762874/AA282C192E5B154C284EFC18D30FF569563E59C3/http //images.akamai.steamusercontent.com/ugc/112985497071762952/4932B3CA6B71571AF2A787991C575C1D6947F9DB/,Dead by Daylight
2016-11-09,0,0,408,False,Recommended,DBD is a fun game but does have quite a lot of bugs. Matchmaking is terrible right now (Veteran rank 1s will get matched with new Rank 20s) which can be quite troubling. Sometimes I also encounter glitchy rocks which makes it hard for me as a survivor to walk/crouch. The peer to peer system is also something I and other dislike. Because of it you'll sometimes get laggy matches (due to Killer hosting it) which can really make it unfun.That aside you can spend quite some time just screwing around with this game. Seeing great teamplay by your teammates is really refreshing too (bodyblock killers distraction etc..) or when the killer decides to be merciful to you. However most people probably won't reach this point. After all this game has a quite steep learning curve. New players won't immediately become good. It takes time and experience on dealing with the killer to learn how to play well and efficient against them. Learn to be unpredictable in what you do don't ever run in a straight line. Watching videos/streamers play DBD will also greatly help you improve as both a Killer or Survivor (I highly recommend this!). So basically don't feel bad when you keep dying as a new survivor or lose against good survivors as a new Killer. The Experiences you go through (which includes learning from your losses) is the key to becoming a better player.,Dead by Daylight
2016-12-24,0,0,214,False,Recommended,MUITO BOM!!!!!!!!,Dead by Daylight
2016-06-17,0,0,3,False,Recommended,If you lust for blood or like getting slaughtered this is the game for you. 10/10,Dead by Daylight
2016-12-16,0,0,48,False,Recommended,Nice coop hide &amp seek game but damn repetitive there s only one way to escape by repairing broken engines. A bit of a disappointment..,Dead by Daylight
2017-01-16,0,0,214,False,Recommended,Product received for free. This game is incredible...if the developers listened then it would be the best game in my library,Dead by Daylight
2017-08-12,0,0,1013,False,Recommended,Good Game Very grindy and Camping killers can be very annoying!,Dead by Daylight
2016-12-19,1,1,185,False,Recommended,A great game to play with friends incredibly fun but i think its a little less good if you play alone.,Dead by Daylight
2016-06-20,0,0,433,False,Not Recommended,Dead by Daylight was a great idea ruined by incompetent developers. The game was fun at launch but has only gotten worse as the developers insist on balancing the game based on faulty statistics and the complaints of only one side of the community.The game is still asymmetrical but instead of it being a horror game where the survivors hide and sneak around a nigh unstoppable killer it's little more than a bullying simulator where the survivors taunt troll and harass a wounded declawed puppy. Imagine in the Friday the 13th movies instead of the victims running in fear of Jason they take away his machete kick him to the ground and shove his face in the mud. That's essentially the Dead by Daylight experience nowadays. Longstanding balance issues making the killers a chore to play have remained in the game for nearly a year while new killers or mechanics that survivors don't like are nerfed into the ground within a week or two. This is especially true with the A Nightmare on Elm Street DLC where the developers announced their intentions to nerf Freddy into the ground because low rank survivors were having a difficult time against him. Despite the fact that he was already considered laughably weak in high ranks.Does this logic make sense to anyone?Releast a new killer intended to shake up gameplay put game on sale to attract more new players Rebalance new killer based on complaints of these new players. I'm starting to wonder if this is some kinda social experiment to see just how much abuse one side of a community is willing to take before abandoning ship. Bottom line stay far far away from this game if you have any interest of playing killer. It's going the way of Evolve.,Dead by Daylight
2016-12-18,0,0,292,False,Not Recommended,1. Killer who camps you2. It take 10 15 min to find a match because so many times people disconnect without a reason.3. So many who disconnect and you can't repair 5 generators in 2 people or alone.4. So many bugs but the developers can do DLC for 7$ because is a P2W because they don't make something good they just make killers and survivors to make money.5. I will regret all my life because I pay 20$ for this,Dead by Daylight
2018-09-30,0,0,191,False,Recommended,"Even after almost 200 hours of playing and getting ""good"" at this game you'll still get mori'd three times in a row and depip because killers are s.If you're looking for a competetive game it's not this one. If you're looking for a fun experience with friends look no further.I rate this game a 3 my current record for being mori'd in a row.",Dead by Daylight
2017-06-24,0,0,25,False,Recommended,I recommend this game 100% at first I thought it would get boring after a while but I was wrong as the game is realy adictive and fun! so if you want to find a game that you will enjoy with your friends and family then this is the game for you ),Rocket League®
2017-06-29,0,0,1204,False,Recommended,Cant stop playing this awesome game!,Rocket League®
2015-08-02,0,0,216,False,Recommended,I played this game with friends once... I had friends once...,Rocket League®
2016-03-26,0,0,62,False,Recommended,this game is fun,Rocket League®
2015-08-13,0,0,73,False,Recommended,I can recommend this to anyone who likes short fast games to play with friends. Really funny and intensive,Rocket League®
2015-07-16,0,0,17,False,Recommended,A great alternative to sweating it out in CS GO.,Rocket League®
2015-08-15,0,0,15,False,Recommended,Great competitive game ) !!!!! Worth every $ and play with Controller and friends for max experience 10/10 ),Rocket League®
2015-08-12,0,0,87,False,Recommended,beest game,Rocket League®
2015-07-18,0,0,149,False,Recommended,SO HYPE,Rocket League®
2015-08-15,0,0,89,False,Recommended,I know I've only had this game less than 24 hours after purchasing it however I tuthfuly feel it's such an awesome game! I also love the idea that it has deidcated server support as well which is a bonus in my eyes especially when I go to LAN's a fair bit. Game graphics I give a high score mechanics are rather snazzy and definitely an enjoyable game all round. Now only thing that I must say that is a little bit on the down side is I did have a tiny bit of lag even choosing Oceanic server's however I was having net troubles I thing during such time so I'm not sure if it's just my internet connection that caused a tiny bit of lag during the 3rd match (3rd match only during near the end) or if it was just the host/whom or whatever that caused it. Anyway leaving on an overall definitely worth the $20 for the game normally now for me I bought the extra aka the sound track and first DLC and even then I'd say it was worth it. So game on dudes and dudettes!,Rocket League®
2017-02-22,1,1,1252,False,Recommended,Okay.,Rocket League®
2016-10-03,0,0,434,False,Recommended,is great game,Rocket League®
2016-10-03,1,1,81,False,Recommended,I Dont Love FootBall Or Cars Bat his Game Auesam.The Graphic Amazing And Every Some Wheeks Added New Cars.And The New Gamemode Release Heroes Mode In The moDE You Have Powers Like Freeze The Ball .,Rocket League®
2016-10-05,0,0,1306,False,Recommended,I didn't think this game was something I would be into but it's just one of those games that anybody can enjoy. I have to play it everyday.,Rocket League®
2016-10-09,0,0,11,False,Recommended,Tons of Fun Addicting and amazing in groups! Both Casually and Competitively.If only this was a real sport.,Rocket League®
2015-08-15,0,0,1368,False,Recommended,Very funny with some friendsBut unplayeble alone,Rocket League®
2016-02-20,0,0,66,False,Recommended,Cool,Rocket League®
2016-01-05,0,0,571,False,Recommended,Nice game you should buy it,Rocket League®
2015-07-13,0,0,614,False,Recommended,As a grown adult it is rare a game captures you as much as rocket league.This is a game that will remind you of just how fun gaming used to be.,Rocket League®
2016-01-21,0,0,414,False,Recommended,so much fungreat pace,Rocket League®
2017-07-24,0,0,141,False,Recommended,This is a well done hybrid of a sports/racing/arcade game. It controls well with a joypad I would not recommend using keyboard/mouse for this game. Highly addictive easy to lose days at a time.,Rocket League®
2016-09-08,0,0,1747,False,Recommended,I might be nubby but If I know anything this game is something EVERYONE should play now you might be asking. I hate soccer but I love cars or I hate cars but I love soccer. Trust me give this game a whirl and you'll fall in love only problem is the matchmaking I see Vets facing Legends or Rocketeers but point aside this game is one of the best I've played and i totes rec. it.Even better once you put enough time into it,Rocket League®
2016-11-25,0,0,1320,False,Recommended,Very addicting even after 1000 hours the skillcap is infinite and the devs are awesome.,Rocket League®
2015-12-15,0,0,790,False,Recommended,Product received for free. + version 2.0,Rocket League®
2016-11-24,0,0,627,False,Recommended,Hurry up and buyand buy dlc cause you dont need it but you want it,Rocket League®
2017-06-30,0,0,1368,False,Recommended,A really adicting game. Best game i ever played. Yessssss....,Rocket League®
2016-11-24,0,0,833,False,Recommended,Quick matches high skill ceiling absolute balance. As a result a highly addictive dopamine fueled rocket powered ballgame. Bonus hats and diligent developers.,Rocket League®
2015-12-21,0,0,436,False,Recommended,If you buy it u will never be the same never stop playing so. BUY IT!,Rocket League®
2016-11-27,0,0,598,False,Recommended,Savage!Savage!Savage!Chat Disabled for 3 Seconds.,Rocket League®
2015-07-16,0,0,703,False,Recommended,Playing PC Games for more than 20 years but this masterpiece is more fun than 99% of all the games I played! Multiplayer Highlight!!UPDATE Still Playing! Still fun! Still getting better (slowly) ...UPDATE 2 It's nearly 600 hours ... time to bash the game now like a normal troll? Won't! Still great!,Rocket League®
2016-01-20,1,1,639,False,Recommended,It's sports for people who hate sports. Love it.I'm totally modifying this for a badge,Rocket League®
2016-11-25,0,0,1593,False,Recommended,"easy to pick up but hard to master it will never be ""just 5 more minutes"" when every new match is dynamic and different",Rocket League®
2016-11-28,0,0,797,False,Recommended,I stopped playing football and now you see what that did to me.,Rocket League®
2017-03-10,0,0,1510,False,Recommended,gggggggg,Rocket League®
2015-08-06,0,0,7,False,Recommended,It is an excelent game i recomend this to anyone who likes having fun.,Rocket League®
2015-07-27,0,0,73,False,Recommended,I am loving this game so far it's football but with flipping rocket cars! I recommend this to everyone who has a pc as it has a small learning curve and you can jump straight into a game.However It does have slight flaws as I have been having reacurring crashing what has been annoying. The game is still great and it just requires some minor patching.,Rocket League®
2017-07-20,0,0,852,False,Recommended,Good Game!,Rocket League®
2016-10-27,0,0,366,False,Recommended,me like a lot,Rocket League®
2016-11-28,0,0,674,False,Recommended,Easy to pick hard to master Extreme fun. Must have game !!! ),Rocket League®
2015-10-09,0,0,393,False,Recommended,Simply one of the most entertaining games of 2015.,Rocket League®
2016-04-22,1,1,2064,False,Recommended,Do you like shouting abuse at players?Chatting to really bad players?And spaming What a Save!Then this game is for you!,Rocket League®
2016-09-12,1,1,158,False,Recommended,good,Rocket League®
2016-11-24,0,0,563,False,Recommended,Got almost 300 hours experience in the game still can't properly hit balls off walls or aerial consistently. 10/10 the learning curve is realSilver for life,Rocket League®
2016-11-25,0,0,99,False,Recommended,Its a very good game very competetive and is a lot of fun with friends,Rocket League®
2015-08-06,0,0,56,False,Recommended,amazing.,Rocket League®
2016-11-28,0,0,19,False,Recommended,Best game ever....,Rocket League®
2017-04-24,0,0,1897,False,Recommended,Product received for free. Best. Game. Ever.... That's All I Have To Say... &lt 3 D,Rocket League®
2016-03-13,0,0,574,False,Recommended,Fast paced hard to get used to but once you get the hang of it it's very fun and satisfying. It's very fun to play with your friends.,Rocket League®
2016-07-12,0,0,530,False,Recommended,Cars that can hit balls is just awesome...,Rocket League®
2017-07-14,0,0,277,False,Recommended,10/10 would get demod again,Rocket League®
2016-11-23,0,0,898,False,Recommended,toooo nice 2999999,Rocket League®
2017-06-27,0,0,616,False,Recommended,Addictive and fun 10/10 would get stuck in elo hell again,Rocket League®
2016-11-11,0,0,910,False,Recommended,still great,Rocket League®
2016-11-25,0,0,208,False,Recommended,Very funny game!!! ),Rocket League®
2017-01-16,0,0,10,False,Recommended,Damn. I m addicted.Best game Ever.,Rocket League®
2016-11-25,1,1,179,False,Recommended,its good,Rocket League®
2016-11-25,0,0,439,False,Recommended,390 hours in and still trying to learn new moves.Easy game to pickup extremely hard to master.Fun for all agesCan't recomend this game enough.Tons of fun,Rocket League®
2016-11-25,0,0,1158,False,Recommended,great game if you have a group of friends to play with or just a co op buddy. not hard to learn but takes a while to master. 10/10,Rocket League®
2017-01-08,1,1,365,False,Recommended,its awesome,Rocket League®
2015-07-29,0,0,31,False,Recommended,Not gonna lie.... it's fun to win but suck to lose but it's still fun to play.,Rocket League®
2015-08-08,0,0,14,False,Recommended,TO ALL NVIDIA LAPTOP USERS For some reason this game is poorly optmized for laptops with nvdia video cards. I could not get the game to run for over 10 seconds without crashing. Therefore I do not recommend this game if you have a laptop with an nvidia graphics card. However if you really want to play the game and you are willing to sacrifice some gameplay quality I have found a way to run the game on a stable 25 45 fps by tweaking some settings. I am currently plaing on an i7 at 2.00 GHz with a geforce 820m w/ 2 GB and 8 GB of ram. Here is what I did 1. In the 3d graphics settings on the nvidia control pannel I selected Rocket League and chose the nvidia processor (rather than the global configuration) in the graphics processor option.2. Reduced game resolution to be smaller than my screen and changed to borderless rather than full screen.3. Set all in game options to quality rather than high quality*optional I overclocked my cpu with msi afterburner and run razer cortex when playing (might help)Hope this helps.Sorry if there is not an in depth review I just wanted to see if I could help anyone who has trouble running this on a laptop. Still recommend the game though.,Rocket League®
2015-07-31,0,0,26,False,Recommended,I know I haven't played that much compare to others however I must say that this is one of the best sports games I have played in a while. Each game is a new experience then the one before. A season game that a wish could also be played with friends (hint hint). This game is action packed even as a sports game leaving the players on the edge of their seat till the last second.,Rocket League®
2015-07-08,0,0,98,False,Recommended,BOOST ERRYWHERE,Rocket League®
2015-08-08,0,0,32,False,Recommended,Fun game must buy.,Rocket League®
2015-07-31,0,0,84,False,Recommended,After only about 2 hours of gameplay i am already convinced that this game will be one of the most fun multiplayer experiences in 2015. The high speeds crazy goals and the rush of adrenaline as you rush to your own side of the pitch trying to defend your goal is really fun. The splitscreen mode and the option to go online with a buddy in splitscreen doubles the fun in my opinion. This game is definately 20 worth!,Rocket League®
2015-08-08,0,0,77,False,Recommended,I'm not a particularly big fan of football hell i'd rather do anything than watch it on TV so when this game came out I had no intention of buying it. It then started appearing on several of the youtube channels I follow *cough* Markiplier *cough* BYZE *cough cough* and yeah it looked like a lot of fun. Ended up buying it and now i'm bloody hooked! Seriously good fun easy to get into takes a little longer to master the controls though. It plays really well the connection can be pretty sketchy (lag terribly) at the start of some matches but for the majority of the time it runs really well.Definitely worth the money football fan or not you should get this game you wont regret it!,Rocket League®
2015-07-29,0,0,57,False,Recommended,If you like football games then you'll love this masterpiece 11/10,Rocket League®
2015-08-12,0,0,311,False,Recommended,I like it!,Rocket League®
2017-05-07,0,0,1,False,Recommended,Best game i love it.,Rocket League®
2015-08-12,0,0,39,False,Recommended,Om du er intressert i racing of fotball så er dette spillet for deg. Dette spillet er kjempegøy og du kan sitte fler timer i strekk med dette spillet. Jeg likte veldig godt det var så billig til å være helt nytt vanligvis er de nye spillene ganske dyre. Du kan customize din egen bil velge blant visse farger og hatter. Du har forskellige modes du kan spille som f.eks. 1v1 2v2 3v3 4v4 SOLO 1v1 SOLO 2v2 SOLO 3v3 og SOLO 4v4. Det vil komme mange DLCer etterhvert og mange nye biler og baner. Jeg har spilt dette i 3 dager nå og det nok det spillet jeg har spilt mest timer i løpet av 3 dager untatt CS GO som også er et helt magisk spill. Jeg annbefaler dette sterkt! (,Rocket League®
2015-07-15,0,0,171,False,Recommended,Really fun to play game.!!,Rocket League®
2017-06-28,0,0,2887,False,Recommended,best,Rocket League®
2015-09-10,4,1,3680,False,Recommended,Still cant fly...,Rocket League®
2016-02-06,0,0,66,False,Recommended,Great fun!Footbal with cars what more do you want?!,Rocket League®
2015-12-22,0,0,30,False,Recommended,Game is incredible. Even though I am terrible it's still fun.,Rocket League®
2016-04-24,0,0,5,False,Recommended,nice,Rocket League®
2016-11-28,0,0,8,False,Recommended,The best soccer game #vote,Rocket League®
2015-11-01,0,0,58,False,Recommended,Spectacular! said all that is needed,Rocket League®
2016-03-16,2,1,649,False,Recommended,great gamez5z5z5,Rocket League®
2017-05-06,0,0,1050,False,Recommended,nice game,Rocket League®
2016-04-13,0,0,167,False,Recommended,As much as I love this game the rubber banding that is happening lately is just giving me cancer in it's purest form. That is if you can even call cancer pureEdit The rubberbanding is gone I fully recommend the game again &lt 3,Rocket League®
2016-09-27,0,0,27,False,Recommended,"Rocket League is what some would describe it to be a ""soccar"" game that has you commandeering a vehicle and using it to get a ball into the opponent's goal. It's basically ""Crash Course Football"" in a dystopian setting involving nitrous oxide and rocket jumping.The abilties applied are equivalent to that of an acutal footballer/soccer player such as ""Bicycle Hit"". It's more simplified from the typical soccer simulators to perform these abilites since you're driving a ball into your oppenent's goal with your car. Because of these simplified mechanics it allows you to construct even the most spontaneous techniques making for an intense set of games. But the game is difficult to get used to due to its implementation of physics.The customization options are quite accessorizing. You can select from various different cars including the DeLorean and Batmobile if you have the DLC You can alter the colors for the specific teams and you can also select the fuel trail wheels roof accessory and antenna for the car.One of the two special game modes is Hoopz a basketball version of the game that makes it more challenging and skill based for the players. This mode pushes you to utilize advanced ablilties in order to put the ball into the hoop. The other mode is Rumble which involves randomly generated powerups that give you a better advantage of scoring a goal. These powerups include a harpoon freezing the ball and switching places with your oppenent.In conclusion this is most definitive form of soccar to play. This game was build from the very concept of soccar and fully executed into a broader experience giving you addtional ways to play. Despite struggling with it at fiirst this game will be the most fun you'll ever have with friends.",Rocket League®
2017-03-30,0,0,103,False,Recommended,10/10,Rocket League®
2017-03-30,1,1,181,False,Recommended,Great game to waste time in.,Rocket League®
2016-07-05,0,0,118,False,Recommended,PROS Addictive and accessible gameplayVery stable online playLots of fun for a relatively low priceCONS Rage quitters paradise due to lack of punishmentOther than that I recommend this game to anyone who enjoys having fun D,Rocket League®
2015-12-22,0,0,167,False,Recommended,Soccer with cars.,Rocket League®
2016-04-24,0,0,5,False,Recommended,great,Rocket League®
2015-09-03,0,0,3851,False,Recommended,I will play rocket league until I die.No other game can be compared to its awesomeness.Shut up and take my money!!!!,Rocket League®
2016-03-15,0,0,425,False,Recommended,This game is amazing I can't stop playing it. Trust me it's worth the $20 you will probably invest hours into it.,Rocket League®
2015-10-15,0,0,327,False,Recommended,It's so fun and so addicting!,Rocket League®
